{
  "contract": {
    "authoritativeLedger": "data/prediction-ledger",
    "internalFieldsExcluded": true,
    "legacyExcludedFromCurrentMetrics": true,
    "probabilityTargetsNeverMixed": true
  },
  "contractVersion": "prediction-ledger-v1",
  "records": [
    {
      "absoluteUpProbability": null,
      "abstainReasons": [
        "生产级差异特征完整度仅50%，低于80%",
        "扣除交易成本后的Top-Bottom收益差不大于0",
        "原始前四分位模型未满足概率校准启用条件"
      ],
      "benchmark": {
        "code": "000985",
        "contractVersion": "a-share-benchmark-csi-all-share-v1",
        "name": "中证全指"
      },
      "calibratedProbability": null,
      "calibrationStatus": "disabled",
      "claim": "截至2026-08-03的量价相对强弱观察；不包含未来方向判断。",
      "counterEvidence": [],
      "createdAt": "2026-08-04T15:36:13+08:00",
      "dataAsOf": "2026-08-03",
      "dueDate": "2026-08-04",
      "effectiveEdge": null,
      "evaluation": null,
      "evidence": [],
      "expectedExcessReturn": null,
      "historicalBaseRate": null,
      "horizonSessions": 1,
      "invalidation": "质量闸门通过前不发布概率。",
      "legacy": false,
      "market": "a-share",
      "modelAvailability": "trained",
      "modelInputCompleteness": 1,
      "modelVersion": "2026-07-21-relative-v2",
      "observationScore": 63.6,
      "outperformanceProbability": null,
      "outputMode": "evidence_observation",
      "predictionDate": "2026-08-03",
      "predictionId": "ab-a-share-20260803-h1-000986-99128b22bc2385bf",
      "probabilitySource": "raw_model",
      "probabilityTarget": "top_quartile",
      "productionFeatureCoverage": 0.5,
      "publicationStatus": "abstained",
      "rawProbability": null,
      "rawScore": null,
      "sectorId": "000986",
      "sectorName": "能源",
      "sourceUrls": [
        "https://www.csindex.com.cn/csindex-home/perf/index-perf?indexCode=000986&startDate=20260803&endDate=20260803",
        "https://www.csindex.com.cn/zh-CN/indices/index-detail/000986"
      ],
      "topQuartileProbability": null,
      "trigger": "ETF申赎、市场广度、融资与机构行为完成两年同口径回填后，生产级特征完整度需达到80%。",
      "universe": {
        "id": "a-core12-v2",
        "sectorIds": [
          "000986",
          "000987",
          "000988",
          "000989",
          "000990",
          "000991",
          "000992",
          "000993",
          "000994",
          "000995",
          "399967",
          "399970"
        ],
        "tieBreak": [
          "expected_excess_desc",
          "sector_id_asc"
        ],
        "topQuartileFraction": 0.25
      }
    },
    {
      "absoluteUpProbability": null,
      "abstainReasons": [
        "生产级差异特征完整度仅50%，低于80%",
        "扣除交易成本后的Top-Bottom收益差不大于0",
        "原始前四分位模型未满足概率校准启用条件"
      ],
      "benchmark": {
        "code": "000985",
        "contractVersion": "a-share-benchmark-csi-all-share-v1",
        "name": "中证全指"
      },
      "calibratedProbability": null,
      "calibrationStatus": "disabled",
      "claim": "截至2026-08-03的量价相对强弱观察；不包含未来方向判断。",
      "counterEvidence": [],
      "createdAt": "2026-08-04T15:36:13+08:00",
      "dataAsOf": "2026-08-03",
      "dueDate": "2026-08-04",
      "effectiveEdge": null,
      "evaluation": null,
      "evidence": [],
      "expectedExcessReturn": null,
      "historicalBaseRate": null,
      "horizonSessions": 1,
      "invalidation": "质量闸门通过前不发布概率。",
      "legacy": false,
      "market": "a-share",
      "modelAvailability": "trained",
      "modelInputCompleteness": 1,
      "modelVersion": "2026-07-21-relative-v2",
      "observationScore": 36.4,
      "outperformanceProbability": null,
      "outputMode": "evidence_observation",
      "predictionDate": "2026-08-03",
      "predictionId": "ab-a-share-20260803-h1-000987-d88fdc5b838878c0",
      "probabilitySource": "raw_model",
      "probabilityTarget": "top_quartile",
      "productionFeatureCoverage": 0.5,
      "publicationStatus": "abstained",
      "rawProbability": null,
      "rawScore": null,
      "sectorId": "000987",
      "sectorName": "原材料",
      "sourceUrls": [
        "https://www.csindex.com.cn/csindex-home/perf/index-perf?indexCode=000987&startDate=20260803&endDate=20260803",
        "https://www.csindex.com.cn/zh-CN/indices/index-detail/000987"
      ],
      "topQuartileProbability": null,
      "trigger": "ETF申赎、市场广度、融资与机构行为完成两年同口径回填后，生产级特征完整度需达到80%。",
      "universe": {
        "id": "a-core12-v2",
        "sectorIds": [
          "000986",
          "000987",
          "000988",
          "000989",
          "000990",
          "000991",
          "000992",
          "000993",
          "000994",
          "000995",
          "399967",
          "399970"
        ],
        "tieBreak": [
          "expected_excess_desc",
          "sector_id_asc"
        ],
        "topQuartileFraction": 0.25
      }
    },
    {
      "absoluteUpProbability": null,
      "abstainReasons": [
        "生产级差异特征完整度仅50%，低于80%",
        "扣除交易成本后的Top-Bottom收益差不大于0",
        "原始前四分位模型未满足概率校准启用条件"
      ],
      "benchmark": {
        "code": "000985",
        "contractVersion": "a-share-benchmark-csi-all-share-v1",
        "name": "中证全指"
      },
      "calibratedProbability": null,
      "calibrationStatus": "disabled",
      "claim": "截至2026-08-03的量价相对强弱观察；不包含未来方向判断。",
      "counterEvidence": [],
      "createdAt": "2026-08-04T15:36:13+08:00",
      "dataAsOf": "2026-08-03",
      "dueDate": "2026-08-04",
      "effectiveEdge": null,
      "evaluation": null,
      "evidence": [],
      "expectedExcessReturn": null,
      "historicalBaseRate": null,
      "horizonSessions": 1,
      "invalidation": "质量闸门通过前不发布概率。",
      "legacy": false,
      "market": "a-share",
      "modelAvailability": "trained",
      "modelInputCompleteness": 1,
      "modelVersion": "2026-07-21-relative-v2",
      "observationScore": 54.5,
      "outperformanceProbability": null,
      "outputMode": "evidence_observation",
      "predictionDate": "2026-08-03",
      "predictionId": "ab-a-share-20260803-h1-000988-0abccce0a4d84858",
      "probabilitySource": "raw_model",
      "probabilityTarget": "top_quartile",
      "productionFeatureCoverage": 0.5,
      "publicationStatus": "abstained",
      "rawProbability": null,
      "rawScore": null,
      "sectorId": "000988",
      "sectorName": "工业",
      "sourceUrls": [
        "https://www.csindex.com.cn/csindex-home/perf/index-perf?indexCode=000988&startDate=20260803&endDate=20260803",
        "https://www.csindex.com.cn/zh-CN/indices/index-detail/000988"
      ],
      "topQuartileProbability": null,
      "trigger": "ETF申赎、市场广度、融资与机构行为完成两年同口径回填后，生产级特征完整度需达到80%。",
      "universe": {
        "id": "a-core12-v2",
        "sectorIds": [
          "000986",
          "000987",
          "000988",
          "000989",
          "000990",
          "000991",
          "000992",
          "000993",
          "000994",
          "000995",
          "399967",
          "399970"
        ],
        "tieBreak": [
          "expected_excess_desc",
          "sector_id_asc"
        ],
        "topQuartileFraction": 0.25
      }
    },
    {
      "absoluteUpProbability": null,
      "abstainReasons": [
        "生产级差异特征完整度仅50%，低于80%",
        "扣除交易成本后的Top-Bottom收益差不大于0",
        "原始前四分位模型未满足概率校准启用条件"
      ],
      "benchmark": {
        "code": "000985",
        "contractVersion": "a-share-benchmark-csi-all-share-v1",
        "name": "中证全指"
      },
      "calibratedProbability": null,
      "calibrationStatus": "disabled",
      "claim": "截至2026-08-03的量价相对强弱观察；不包含未来方向判断。",
      "counterEvidence": [],
      "createdAt": "2026-08-04T15:36:13+08:00",
      "dataAsOf": "2026-08-03",
      "dueDate": "2026-08-04",
      "effectiveEdge": null,
      "evaluation": null,
      "evidence": [],
      "expectedExcessReturn": null,
      "historicalBaseRate": null,
      "horizonSessions": 1,
      "invalidation": "质量闸门通过前不发布概率。",
      "legacy": false,
      "market": "a-share",
      "modelAvailability": "trained",
      "modelInputCompleteness": 1,
      "modelVersion": "2026-07-21-relative-v2",
      "observationScore": 81.8,
      "outperformanceProbability": null,
      "outputMode": "evidence_observation",
      "predictionDate": "2026-08-03",
      "predictionId": "ab-a-share-20260803-h1-000989-4b393f429c8c90f4",
      "probabilitySource": "raw_model",
      "probabilityTarget": "top_quartile",
      "productionFeatureCoverage": 0.5,
      "publicationStatus": "abstained",
      "rawProbability": null,
      "rawScore": null,
      "sectorId": "000989",
      "sectorName": "可选消费",
      "sourceUrls": [
        "https://www.csindex.com.cn/csindex-home/perf/index-perf?indexCode=000989&startDate=20260803&endDate=20260803",
        "https://www.csindex.com.cn/zh-CN/indices/index-detail/000989"
      ],
      "topQuartileProbability": null,
      "trigger": "ETF申赎、市场广度、融资与机构行为完成两年同口径回填后，生产级特征完整度需达到80%。",
      "universe": {
        "id": "a-core12-v2",
        "sectorIds": [
          "000986",
          "000987",
          "000988",
          "000989",
          "000990",
          "000991",
          "000992",
          "000993",
          "000994",
          "000995",
          "399967",
          "399970"
        ],
        "tieBreak": [
          "expected_excess_desc",
          "sector_id_asc"
        ],
        "topQuartileFraction": 0.25
      }
    },
    {
      "absoluteUpProbability": null,
      "abstainReasons": [
        "生产级差异特征完整度仅50%，低于80%",
        "扣除交易成本后的Top-Bottom收益差不大于0",
        "原始前四分位模型未满足概率校准启用条件"
      ],
      "benchmark": {
        "code": "000985",
        "contractVersion": "a-share-benchmark-csi-all-share-v1",
        "name": "中证全指"
      },
      "calibratedProbability": null,
      "calibrationStatus": "disabled",
      "claim": "截至2026-08-03的量价相对强弱观察；不包含未来方向判断。",
      "counterEvidence": [],
      "createdAt": "2026-08-04T15:36:13+08:00",
      "dataAsOf": "2026-08-03",
      "dueDate": "2026-08-04",
      "effectiveEdge": null,
      "evaluation": null,
      "evidence": [],